[
  {
    "IdLivraison": "LIV001",
    "IdRapport": "RQ001",
    "Date_prevue": "2026-03-17",
    "Date_effective": "2026-03-17",
    "lieu_livraison": "Lille Europe",
    "Statut_livraison": "Livree"
  },
  {
    "IdLivraison": "LIV002",
    "IdRapport": "RQ002",
    "Date_prevue": "2026-07-26",
    "Date_effective": null,
    "lieu_livraison": "Lille Europe",
    "Statut_livraison": "Planifiee"
  },
  {
    "IdLivraison": "LIV003",
    "IdRapport": "RQ003",
    "Date_prevue": "2026-06-28",
    "Date_effective": null,
    "lieu_livraison": "Paris Centre",
    "Statut_livraison": "En cours"
  },
  {
    "IdLivraison": "LIV004",
    "IdRapport": "RQ004",
    "Date_prevue": "2026-05-09",
    "Date_effective": "2026-05-10",
    "lieu_livraison": "Marseille Gare",
    "Statut_livraison": "Livree"
  },
  {
    "IdLivraison": "LIV005",
    "IdRapport": "RQ005",
    "Date_prevue": "2026-05-08",
    "Date_effective": "2026-05-10",
    "lieu_livraison": "Lyon Sud",
    "Statut_livraison": "Livree"
  },
  {
    "IdLivraison": "LIV006",
    "IdRapport": "RQ006",
    "Date_prevue": "2026-04-02",
    "Date_effective": "2026-04-04",
    "lieu_livraison": "Bordeaux Lac",
    "Statut_livraison": "Livree"
  },
  {
    "IdLivraison": "LIV007",
    "IdRapport": "RQ007",
    "Date_prevue": "2026-08-15",
    "Date_effective": null,
    "lieu_livraison": "Paris Nord",
    "Statut_livraison": "En cours"
  },
  {
    "IdLivraison": "LIV008",
    "IdRapport": "RQ008",
    "Date_prevue": "2026-04-03",
    "Date_effective": null,
    "lieu_livraison": "Paris Centre",
    "Statut_livraison": "En cours"
  },
  {
    "IdLivraison": "LIV009",
    "IdRapport": "RQ009",
    "Date_prevue": "2026-04-02",
    "Date_effective": "2026-04-02",
    "lieu_livraison": "Bordeaux Lac",
    "Statut_livraison": "Livree"
  },
  {
    "IdLivraison": "LIV010",
    "IdRapport": "RQ010",
    "Date_prevue": "2026-07-13",
    "Date_effective": null,
    "lieu_livraison": "Strasbourg Gare",
    "Statut_livraison": "Planifiee"
  },
  {
    "IdLivraison": "LIV011",
    "IdRapport": "RQ011",
    "Date_prevue": "2026-03-25",
    "Date_effective": "2026-03-26",
    "lieu_livraison": "Bordeaux Lac",
    "Statut_livraison": "Livree"
  },
  {
    "IdLivraison": "LIV012",
    "IdRapport": "RQ012",
    "Date_prevue": "2026-08-11",
    "Date_effective": "2026-08-11",
    "lieu_livraison": "Marseille Gare",
    "Statut_livraison": "Livree"
  },
  {
    "IdLivraison": "LIV013",
    "IdRapport": "RQ013",
    "Date_prevue": "2026-06-13",
    "Date_effective": null,
    "lieu_livraison": "Bordeaux Centre",
    "Statut_livraison": "En cours"
  },
  {
    "IdLivraison": "LIV014",
    "IdRapport": "RQ014",
    "Date_prevue": "2026-05-06",
    "Date_effective": null,
    "lieu_livraison": "Lyon Sud",
    "Statut_livraison": "En cours"
  },
  {
    "IdLivraison": "LIV015",
    "IdRapport": "RQ015",
    "Date_prevue": "2026-05-26",
    "Date_effective": null,
    "lieu_livraison": "Toulouse Sud",
    "Statut_livraison": "Planifiee"
  },
  {
    "IdLivraison": "LIV016",
    "IdRapport": "RQ016",
    "Date_prevue": "2026-08-14",
    "Date_effective": "2026-08-15",
    "lieu_livraison": "Rennes Ouest",
    "Statut_livraison": "Livree"
  },
  {
    "IdLivraison": "LIV017",
    "IdRapport": "RQ017",
    "Date_prevue": "2026-07-10",
    "Date_effective": "2026-07-10",
    "lieu_livraison": "Lyon Gare",
    "Statut_livraison": "Livree"
  },
  {
    "IdLivraison": "LIV018",
    "IdRapport": "RQ018",
    "Date_prevue": "2026-08-10",
    "Date_effective": "2026-08-11",
    "lieu_livraison": "Rennes Ouest",
    "Statut_livraison": "Livree"
  },
  {
    "IdLivraison": "LIV019",
    "IdRapport": "RQ019",
    "Date_prevue": "2026-04-23",
    "Date_effective": null,
    "lieu_livraison": "Bordeaux Lac",
    "Statut_livraison": "En cours"
  },
  {
    "IdLivraison": "LIV020",
    "IdRapport": "RQ020",
    "Date_prevue": "2026-03-24",
    "Date_effective": "2026-03-26",
    "lieu_livraison": "Nantes Atlantique",
    "Statut_livraison": "Livree"
  },
  {
    "IdLivraison": "LIV021",
    "IdRapport": "RQ021",
    "Date_prevue": "2026-08-26",
    "Date_effective": "2026-08-26",
    "lieu_livraison": "Paris Nord",
    "Statut_livraison": "Livree"
  },
  {
    "IdLivraison": "LIV022",
    "IdRapport": "RQ022",
    "Date_prevue": "2026-05-17",
    "Date_effective": "2026-05-17",
    "lieu_livraison": "Marseille Port",
    "Statut_livraison": "Livree"
  },
  {
    "IdLivraison": "LIV023",
    "IdRapport": "RQ023",
    "Date_prevue": "2026-08-26",
    "Date_effective": null,
    "lieu_livraison": "Paris Centre",
    "Statut_livraison": "En cours"
  },
  {
    "IdLivraison": "LIV024",
    "IdRapport": "RQ024",
    "Date_prevue": "2026-03-08",
    "Date_effective": "2026-03-09",
    "lieu_livraison": "Nantes Atlantique",
    "Statut_livraison": "Livree"
  },
  {
    "IdLivraison": "LIV025",
    "IdRapport": "RQ025",
    "Date_prevue": "2026-03-20",
    "Date_effective": "2026-03-22",
    "lieu_livraison": "Strasbourg Gare",
    "Statut_livraison": "Livree"
  },
  {
    "IdLivraison": "LIV026",
    "IdRapport": "RQ026",
    "Date_prevue": "2026-05-15",
    "Date_effective": "2026-05-17",
    "lieu_livraison": "Marseille Port",
    "Statut_livraison": "Livree"
  },
  {
    "IdLivraison": "LIV027",
    "IdRapport": "RQ027",
    "Date_prevue": "2026-05-13",
    "Date_effective": "2026-05-15",
    "lieu_livraison": "Toulouse Sud",
    "Statut_livraison": "Livree"
  },
  {
    "IdLivraison": "LIV028",
    "IdRapport": "RQ028",
    "Date_prevue": "2026-03-01",
    "Date_effective": "2026-03-02",
    "lieu_livraison": "Lille Europe",
    "Statut_livraison": "Livree"
  },
  {
    "IdLivraison": "LIV029",
    "IdRapport": "RQ029",
    "Date_prevue": "2026-07-04",
    "Date_effective": "2026-07-05",
    "lieu_livraison": "Lyon Sud",
    "Statut_livraison": "Livree"
  },
  {
    "IdLivraison": "LIV030",
    "IdRapport": "RQ030",
    "Date_prevue": "2026-04-20",
    "Date_effective": "2026-04-22",
    "lieu_livraison": "Bordeaux Centre",
    "Statut_livraison": "Livree"
  },
  {
    "IdLivraison": "LIV031",
    "IdRapport": "RQ031",
    "Date_prevue": "2026-04-04",
    "Date_effective": "2026-04-04",
    "lieu_livraison": "Strasbourg Gare",
    "Statut_livraison": "Livree"
  },
  {
    "IdLivraison": "LIV032",
    "IdRapport": "RQ032",
    "Date_prevue": "2026-08-15",
    "Date_effective": "2026-08-17",
    "lieu_livraison": "Toulouse Centre",
    "Statut_livraison": "Livree"
  },
  {
    "IdLivraison": "LIV033",
    "IdRapport": "RQ033",
    "Date_prevue": "2026-08-12",
    "Date_effective": "2026-08-14",
    "lieu_livraison": "Lille Europe",
    "Statut_livraison": "Livree"
  },
  {
    "IdLivraison": "LIV034",
    "IdRapport": "RQ034",
    "Date_prevue": "2026-05-28",
    "Date_effective": "2026-05-28",
    "lieu_livraison": "Lyon Sud",
    "Statut_livraison": "Livree"
  },
  {
    "IdLivraison": "LIV035",
    "IdRapport": "RQ035",
    "Date_prevue": "2026-05-17",
    "Date_effective": "2026-05-17",
    "lieu_livraison": "Sochaux Depot",
    "Statut_livraison": "Livree"
  },
  {
    "IdLivraison": "LIV036",
    "IdRapport": "RQ036",
    "Date_prevue": "2026-04-26",
    "Date_effective": null,
    "lieu_livraison": "Paris Centre",
    "Statut_livraison": "En cours"
  },
  {
    "IdLivraison": "LIV037",
    "IdRapport": "RQ037",
    "Date_prevue": "2026-07-19",
    "Date_effective": "2026-07-20",
    "lieu_livraison": "Marseille Gare",
    "Statut_livraison": "Livree"
  },
  {
    "IdLivraison": "LIV038",
    "IdRapport": "RQ038",
    "Date_prevue": "2026-04-20",
    "Date_effective": "2026-04-20",
    "lieu_livraison": "Toulouse Sud",
    "Statut_livraison": "Livree"
  },
  {
    "IdLivraison": "LIV039",
    "IdRapport": "RQ039",
    "Date_prevue": "2026-08-24",
    "Date_effective": null,
    "lieu_livraison": "Lille Europe",
    "Statut_livraison": "En cours"
  },
  {
    "IdLivraison": "LIV040",
    "IdRapport": "RQ040",
    "Date_prevue": "2026-06-27",
    "Date_effective": null,
    "lieu_livraison": "Lyon Gare",
    "Statut_livraison": "Planifiee"
  },
  {
    "IdLivraison": "LIV041",
    "IdRapport": "RQ041",
    "Date_prevue": "2026-05-21",
    "Date_effective": "2026-05-22",
    "lieu_livraison": "Strasbourg Gare",
    "Statut_livraison": "Livree"
  },
  {
    "IdLivraison": "LIV042",
    "IdRapport": "RQ042",
    "Date_prevue": "2026-05-05",
    "Date_effective": null,
    "lieu_livraison": "Paris Nord",
    "Statut_livraison": "Planifiee"
  },
  {
    "IdLivraison": "LIV043",
    "IdRapport": "RQ043",
    "Date_prevue": "2026-04-25",
    "Date_effective": "2026-04-26",
    "lieu_livraison": "Lille Europe",
    "Statut_livraison": "Livree"
  },
  {
    "IdLivraison": "LIV044",
    "IdRapport": "RQ044",
    "Date_prevue": "2026-03-17",
    "Date_effective": "2026-03-18",
    "lieu_livraison": "Marseille Port",
    "Statut_livraison": "Livree"
  },
  {
    "IdLivraison": "LIV045",
    "IdRapport": "RQ045",
    "Date_prevue": "2026-05-23",
    "Date_effective": "2026-05-24",
    "lieu_livraison": "Lille Europe",
    "Statut_livraison": "Livree"
  },
  {
    "IdLivraison": "LIV046",
    "IdRapport": "RQ046",
    "Date_prevue": "2026-03-09",
    "Date_effective": "2026-03-11",
    "lieu_livraison": "Lille Europe",
    "Statut_livraison": "Livree"
  },
  {
    "IdLivraison": "LIV047",
    "IdRapport": "RQ047",
    "Date_prevue": "2026-04-21",
    "Date_effective": "2026-04-23",
    "lieu_livraison": "Lille Europe",
    "Statut_livraison": "Livree"
  },
  {
    "IdLivraison": "LIV048",
    "IdRapport": "RQ048",
    "Date_prevue": "2026-07-21",
    "Date_effective": "2026-07-23",
    "lieu_livraison": "Rennes Ouest",
    "Statut_livraison": "Livree"
  },
  {
    "IdLivraison": "LIV049",
    "IdRapport": "RQ049",
    "Date_prevue": "2026-04-22",
    "Date_effective": null,
    "lieu_livraison": "Lyon Sud",
    "Statut_livraison": "Planifiee"
  },
  {
    "IdLivraison": "LIV050",
    "IdRapport": "RQ050",